B1: Open DEFECTs that noone works with | C1: Resolved DEFECTs in 0.9.6 | D1: Resolved DEFECTs in 0.9.7 | E1: Resolved DEFECTs in 0.9.8 | F1: Resolved DEFECTs in 0.9.9 | G1: Older resolved DEFECTs | H1: The list of Open DEFECTs that someone works with | I1: Open issues that noone works with | J1: Resolved issues in 0.9.6 | K1: Resolved issues in 0.9.7 | L1: Resolved issues in 0.9.8 | M1: Resolved issues in 0.9.9 | N1: Rejected issues | O1: Older resolved issues | P1: Verified issues | Q1: The list of all Open issues for Other | R1: The list of Open issues that someone works with | S1: Critics Fired when RE ArgoUML
A2: 37332 | B2: 250 | C2: 1 | D2: 13 | G2: 134 | H2: 7 | I2: 363 | J2: 3 | K2: 13 | N2: 128 | O2: 145 | P2: 14 | Q2: 103 | R2: 12
A3: 37339 | B3: 236 | C3: 0 | D3: 12 | G3: 125 | H3: 10 | I3: 348 | J3: 1 | K3: 12 | N3: 140 | O3: 134 | P3: 23 | Q3: 100 | R3: 15
A4: 37346 | B4: 232 | C4: 0 | D4: 12 | G4: 125 | H4: 11 | I4: =348-1 -> 347 | J4: 1 | K4: 12 | N4: 144 | O4: 134 | P4: 23 | Q4: 98 | R4: 16
A5: 37353 | B5: 231 | C5: 0 | D5: 12 | E5: 16 | G5: 126 | H5: 8 | I5: 348 | J5: 1 | K5: 12 | L5: 18 | N5: 144 | O5: 135 | P5: 25 | Q5: 101 | R5: 14
A6: 37360 | B6: 232 | C6: 0 | D6: 11 | E6: 9 | G6: 124 | H6: 9 | I6: 350 | J6: 1 | K6: 11 | L6: 11 | N6: 146 | O6: 133 | P6: 27 | Q6: 102 | R6: 16
A7: 37367 | B7: 229 | C7: 0 | D7: 11 | E7: 10 | G7: 124 | H7: 8 | I7: 353 | J7: 1 | K7: 11 | L7: 12 | N7: 147 | O7: 133 | P7: 27 | Q7: 105 | R7: 15
A8: 37374 | B8: 231 | C8: 0 | D8: 11 | E8: 10 | G8: 124 | H8: 8 | I8: 354 | J8: 1 | K8: 11 | L8: 12 | N8: 150 | O8: 133 | P8: 27 | Q8: 105 | R8: 14
A9: 37381 | B9: 236 | C9: 0 | D9: 11 | E9: 10 | F9: 5 | G9: 124 | H9: 8 | I9: 364 | J9: 1 | K9: 11 | L9: 12 | M9: 6 | N9: 151 | O9: 133 | P9: 27 | Q9: 110 | R9: 13
A10: 37388 | B10: 218 | C10: 0 | D10: 10 | E10: 4 | F10: 6 | G10: 122 | H10: 8 | I10: 366 | J10: 1 | K10: 10 | L10: 6 | M10: 7 | N10: 115 | O10: 131 | P10: 77 | Q10: 108 | R10: 13
A11: 37395 | B11: 221 | C11: 0 | D11: 10 | E11: 4 | F11: 6 | G11: 122 | H11: 8 | I11: 370 | J11: 1 | K11: 10 | L11: 6 | M11: 7 | N11: 115 | O11: 131 | P11: 77 | Q11: 110 | R11: 14
A12: 37402 | B12: =223-1 -> 222 | C12: 0 | D12: 10 | E12: 4 | F12: 6 | G12: 122 | H12: 8 | I12: =375-3 -> 372 | J12: 1 | K12: 10 | L12: 6 | M12: 7 | N12: 116 | O12: 131 | P12: 77 | Q12: 110 | R12: 14
A13: 37409 | B13: 227 | C13: 0 | D13: 10 | E13: 4 | F13: 6 | G13: 122 | H13: 9 | I13: 379 | J13: 1 | K13: 10 | L13: 6 | M13: 7 | N13: 116 | O13: 131 | P13: 77 | Q13: 110 | R13: 15
A14: 37416 | B14: 229 | C14: 0 | D14: 0 | E14: 4 | F14: 6 | G14: 0 | H14: 9 | I14: 379 | J14: 1 | K14: 0 | L14: 6 | M14: 7 | N14: 118 | O14: 9 | P14: 128 | Q14: 109 | R14: 14
A15: 37423 | B15: 225 | C15: 0 | D15: 0 | E15: 4 | F15: 6 | G15: 0 | H15: 8 | I15: 382 | J15: 1 | K15: 0 | L15: 6 | M15: 7 | N15: 119 | O15: 9 | P15: 128 | Q15: 112 | R15: 14
A16: 37430 | B16: =AVERAGE(B15,B17) -> 232 | C16: =AVERAGE(C15,C17) -> 0 | D16: =AVERAGE(D15,D17) -> 0 | E16: =AVERAGE(E15,E17) -> 4 | F16: =AVERAGE(F15,F17) -> 6 | G16: =AVERAGE(G15,G17) -> 0 | H16: =AVERAGE(H15,H17) -> 8 | I16: =AVERAGE(I15,I17) -> 389.5 | J16: =AVERAGE(J15,J17) -> 1 | K16: =AVERAGE(K15,K17) -> 0 | L16: =AVERAGE(L15,L17) -> 6 | M16: =AVERAGE(M15,M17) -> 7 | N16: =AVERAGE(N15,N17) -> 120 | O16: =AVERAGE(O15,O17) -> 9 | P16: =AVERAGE(P15,P17) -> 128 | Q16: =AVERAGE(Q15,Q17) -> 113.5 | R16: =AVERAGE(R15,R17) -> 14.5 | T16: Estimated
A17: 37437 | B17: =245-6 -> 239 | C17: 0 | D17: 0 | E17: 4 | F17: 6 | G17: 0 | H17: 8 | I17: =403-6 -> 397 | J17: 1 | K17: 0 | L17: 6 | M17: 7 | N17: 121 | O17: 9 | P17: 128 | Q17: 115 | R17: 15
A18: 37444 | B18: =240-2 -> 238 | C18: 0 | D18: 1 | E18: 4 | F18: 6 | G18: 1 | H18: 7 | I18: =401-3 -> 398 | J18: 1 | K18: 1 | L18: 6 | M18: 7 | N18: 125 | O18: 10 | P18: 131 | Q18: 115 | R18: 15 | S18: 3428
A19: 37451 | B19: 228 | C19: 0 | D19: 1 | E19: 4 | F19: 6 | G19: 1 | H19: 8 | I19: 389 | J19: 1 | K19: 1 | L19: 6 | M19: 7 | N19: 124 | O19: 10 | P19: 130 | Q19: 108 | R19: 17 | S19: 3469
A20: 37458 | B20: =AVERAGE(B19,B21) -> 205.5 | C20: =AVERAGE(C19,C21) -> 0 | D20: =AVERAGE(D19,D21) -> 1 | E20: =AVERAGE(E19,E21) -> 4 | F20: =AVERAGE(F19,F21) -> 6 | G20: =AVERAGE(G19,G21) -> 1 | H20: =AVERAGE(H19,H21) -> 7.5 | I20: =AVERAGE(I19,I21) -> 369 | J20: =AVERAGE(J19,J21) -> 1 | K20: =AVERAGE(K19,K21) -> 1 | L20: =AVERAGE(L19,L21) -> 6 | M20: =AVERAGE(M19,M21) -> 7 | N20: =AVERAGE(N19,N21) -> 131 | O20: =AVERAGE(O19,O21) -> 10 | P20: =AVERAGE(P19,P21) -> 130.5 | Q20: =AVERAGE(Q19,Q21) -> 104.5 | R20: =AVERAGE(R19,R21) -> 17 | S20: =AVERAGE(S19,S21) -> 3513 | T20: Estimated
A21: 37465 | B21: =174+1+1+2+2-1-10+1+13 -> 183 | C21: 0 | D21: 1 | E21: 4 | F21: 6 | G21: 1 | H21: =9-2 -> 7 | I21: =341+1+2+2-1-10+1+13 -> 349 | J21: 1 | K21: 1 | L21: 6 | M21: 7 | N21: =139-1 -> 138 | O21: 10 | P21: =132-1 -> 131 | Q21: 101 | R21: =19-2 -> 17 | S21: 3557