B1: Open DEFECTs that noone works with | C1: Open DEFECTs that someone works with | D1: Resolved DEFECTS in 0.9.* | E1: Resolved DEFECTS in 0.11.* | F1: Resolved DEFECTS in 0.13.* and 0.14 | G1: Open issues that noone works with | H1: Open issues that someone works with | I1: Resolved in 0.9.* | J1: Resolved in 0.11.* | K1: Resolved in 0.13.* and 0.14 | L1: Rejected issues | M1: Verified issues | N1: Open issues for Other | O1: Members | P1: Critics Fired when RE ArgoUML | Q1: CPU-time when importing everything
A2: 37332 | B2: 250 | C2: 7 | D2: 148 | F2: 0 | G2: 363 | H2: 12 | I2: 161 | K2: 0 | L2: 128 | M2: 14 | N2: 103
A3: 37339 | B3: 236 | C3: 10 | D3: 137 | F3: 0 | G3: 348 | H3: 15 | I3: 147 | K3: 0 | L3: 140 | M3: 23 | N3: 100
A4: 37346 | B4: 232 | C4: 11 | D4: 137 | F4: 0 | G4: =348-1 -> 347 | H4: 16 | I4: 147 | K4: 0 | L4: 144 | M4: 23 | N4: 98
A5: 37353 | B5: 231 | C5: 8 | D5: 154 | F5: 0 | G5: 348 | H5: 14 | I5: 166 | K5: 0 | L5: 144 | M5: 25 | N5: 101
A6: 37360 | B6: 232 | C6: 9 | D6: 144 | F6: 0 | G6: 350 | H6: 16 | I6: 156 | K6: 0 | L6: 146 | M6: 27 | N6: 102
A7: 37367 | B7: 229 | C7: 8 | D7: 145 | F7: 0 | G7: 353 | H7: 15 | I7: 157 | K7: 0 | L7: 147 | M7: 27 | N7: 105
A8: 37374 | B8: 231 | C8: 8 | D8: 145 | F8: 0 | G8: 354 | H8: 14 | I8: 157 | K8: 0 | L8: 150 | M8: 27 | N8: 105
A9: 37381 | B9: 236 | C9: 8 | D9: 150 | F9: 0 | G9: 364 | H9: 13 | I9: 163 | K9: 0 | L9: 151 | M9: 27 | N9: 110
A10: 37388 | B10: 218 | C10: 8 | D10: 142 | F10: 0 | G10: 366 | H10: 13 | I10: 155 | K10: 0 | L10: 115 | M10: 77 | N10: 108
A11: 37395 | B11: 221 | C11: 8 | D11: 142 | F11: 0 | G11: 370 | H11: 14 | I11: 155 | K11: 0 | L11: 115 | M11: 77 | N11: 110
A12: 37402 | B12: =223-1 -> 222 | C12: 8 | D12: 142 | F12: 0 | G12: =375-3 -> 372 | H12: 14 | I12: 155 | K12: 0 | L12: 116 | M12: 77 | N12: 110
A13: 37409 | B13: 227 | C13: 9 | D13: 142 | F13: 0 | G13: 379 | H13: 15 | I13: 155 | K13: 0 | L13: 116 | M13: 77 | N13: 110
A14: 37416 | B14: 229 | C14: 9 | D14: 10 | F14: 0 | G14: 379 | H14: 14 | I14: 23 | K14: 0 | L14: 118 | M14: 128 | N14: 109
A15: 37423 | B15: 225 | C15: 8 | D15: 10 | F15: 0 | G15: 382 | H15: 14 | I15: 23 | K15: 0 | L15: 119 | M15: 128 | N15: 112
A16: 37430 | B16: =AVERAGE(B15,B17) -> 232 | C16: =AVERAGE(C15,C17) -> 8 | D16: 10 | F16: 0 | G16: =AVERAGE(G15,G17) -> 389.5 | H16: =AVERAGE(H15,H17) -> 14.5 | I16: 23 | K16: 0 | L16: =AVERAGE(L15,L17) -> 120 | M16: =AVERAGE(M15,M17) -> 128 | N16: =AVERAGE(N15,N17) -> 113.5 | R16: Estimated
A17: 37437 | B17: =245-6 -> 239 | C17: 8 | D17: 10 | F17: 0 | G17: =403-6 -> 397 | H17: 15 | I17: 23 | K17: 0 | L17: 121 | M17: 128 | N17: 115
A18: 37444 | B18: =240-2 -> 238 | C18: 7 | D18: 12 | F18: 0 | G18: =401-3 -> 398 | H18: 15 | I18: 25 | K18: 0 | L18: 125 | M18: 131 | N18: 115 | P18: 3428
A19: 37451 | B19: 228 | C19: 8 | D19: 12 | F19: 0 | G19: 389 | H19: 17 | I19: 25 | K19: 0 | L19: 124 | M19: 130 | N19: 108 | P19: 3469
A20: 37458 | B20: =AVERAGE(B19,B21) -> 205.5 | C20: =AVERAGE(C19,C21) -> 7.5 | D20: 12 | F20: 0 | G20: =AVERAGE(G19,G21) -> 369 | H20: =AVERAGE(H19,H21) -> 17 | I20: 25 | K20: 0 | L20: =AVERAGE(L19,L21) -> 131 | M20: =AVERAGE(M19,M21) -> 130.5 | N20: =AVERAGE(N19,N21) -> 104.5 | P20: =AVERAGE(P19,P21) -> 3513 | R20: Estimated
A21: 37465 | B21: =174+1+1+2+2-1-10+1+13 -> 183 | C21: =9-2 -> 7 | D21: 12 | F21: 0 | G21: =341+1+2+2-1-10+1+13 -> 349 | H21: =19-2 -> 17 | I21: 25 | K21: 0 | L21: =139-1 -> 138 | M21: =132-1 -> 131 | N21: 101 | P21: 3557
A22: 37474 | B22: 169 | C22: 10 | D22: 11 | E22: 64 | F22: 0 | G22: 343 | H22: 19 | I22: 15 | J22: 67 | K22: 0 | L22: 142 | M22: 132 | N22: 107 | P22: 3557 | R22: Critics guessed
A23: 37479 | B23: =175-2+2 -> 175 | C23: 10 | D23: 11 | E23: 64 | F23: 0 | G23: =354-6+3 -> 351 | H23: 21 | I23: 15 | J23: 67 | K23: 0 | L23: 143 | M23: 130 | N23: 114 | P23: 2457
A24: 37486 | B24: 172 | C24: 10 | D24: 11 | E24: 66 | F24: 0 | G24: 351 | H24: 22 | I24: 15 | J24: 69 | K24: 0 | L24: 151 | M24: 130 | N24: 114 | P24: 2514
A25: 37493 | B25: 171 | C25: 8 | D25: 11 | E25: 84 | F25: 0 | G25: 350 | H25: 20 | I25: 15 | J25: 88 | K25: 0 | L25: 153 | M25: 130 | N25: 114 | P25: 2535
A26: 37500 | B26: 173 | C26: 9 | D26: 11 | E26: 84 | F26: 0 | G26: 357 | H26: 22 | I26: 15 | J26: 88 | K26: 0 | L26: 155 | M26: 131 | N26: 118 | P26: 2537
A27: 37507 | B27: 144 | C27: 5 | D27: 1 | E27: 57 | F27: 0 | G27: 340 | H27: 18 | I27: 4 | J27: 61 | K27: 0 | L27: 115 | M27: 213 | N27: 113 | P27: 2469
A28: 37514 | B28: 139 | C28: 5 | D28: 0 | E28: 6 | F28: 0 | G28: 334 | H28: 18 | I28: 3 | J28: 7 | K28: 0 | L28: 36 | M28: 351 | N28: 111 | P28: 2580 | R28: Problem to determine
A29: 37528 | B29: 159 | C29: 28 | D29: 0 | E29: 9 | F29: 0 | G29: 373 | H29: 46 | I29: 1 | J29: 11 | K29: 0 | L29: 12 | M29: 352 | N29: 108 | P29: 2602
A30: 37535 | B30: 164 | C30: 41 | D30: 0 | E30: 21 | F30: 0 | G30: 380 | H30: 61 | I30: 0 | J30: 22 | K30: 0 | L30: 9 | M30: 382 | N30: 111 | P30: 2594
A31: 37549 | B31: 194 | C31: 7 | D31: 0 | E31: 10 | F31: 0 | G31: 416 | H31: 26 | I31: 0 | J31: 11 | K31: 0 | L31: 14 | M31: 408 | N31: 109 | P31: 2743
A32: 37570 | B32: 196 | C32: 6 | D32: 0 | E32: 10 | F32: 0 | G32: 418 | H32: 22 | I32: 0 | J32: 11 | K32: 0 | L32: 13 | M32: 424 | N32: 104 | P32: 2342 | Q32: 0.33194444444444443
A33: 37577 | B33: 208 | C33: 2 | D33: 0 | E33: 10 | F33: 0 | G33: 439 | H33: 10 | I33: 0 | J33: 11 | K33: 0 | L33: 13 | M33: 374 | N33: 105 | P33: 2344 | Q33: 2.7777777777777776E-2 | R33: 0.13.1
A34: 37585 | B34: 197 | C34: 2 | D34: 0 | E34: 10 | F34: 0 | G34: 430 | H34: 12 | I34: 0 | J34: 11 | K34: 0 | L34: 19 | M34: 374 | N34: 106 | P34: 2349 | Q34: 2.2916666666666669E-2
A35: 37592 | B35: 178 | C35: 3 | D35: 0 | E35: 10 | F35: 59 | G35: 410 | H35: 13 | I35: 0 | J35: 11 | K35: 68 | L35: 25 | M35: 378 | N35: 110
A36: 37598 | B36: 167 | C36: 2 | D36: 0 | E36: 10 | F36: 59 | G36: 402 | H36: 12 | I36: 0 | J36: 11 | K36: 68 | L36: 22 | M36: 385 | N36: 110 | P36: 2364 | Q36: 1.5972222222222224E-2
A37: 37626 | B37: 158 | C37: 11 | D37: 0 | E37: 10 | F37: 59 | G37: 399 | H37: 23 | I37: 0 | J37: 11 | K37: 68 | L37: 20 | M37: 392 | N37: 106
A38: 37641 | B38: 163 | C38: 10 | D38: 0 | E38: 10 | F38: 59 | G38: 406 | H38: 22 | I38: 0 | J38: 11 | K38: 68 | L38: 15 | M38: 401 | N38: 108
A39: 37661 | B39: 166 | C39: 9 | D39: 0 | E39: 10 | F39: 11 | G39: 413 | H39: 19 | I39: 0 | J39: 11 | K39: 16 | L39: 12 | M39: 305 | N39: 104
A40: 37685 | B40: 183 | C40: 7 | D40: 0 | E40: 9 | F40: 169 | G40: 441 | H40: 17 | I40: 0 | J40: 10 | K40: 202 | L40: 25 | M40: 305 | N40: 107
A41: 37696 | B41: 184 | C41: 7 | D41: 0 | E41: 9 | F41: 186 | G41: 444 | H41: 17 | I41: 0 | J41: 10 | K41: 222 | L41: 26 | M41: 316 | N41: 107 | P41: 2861 | Q41: 6.1342592592592594E-3
A42: 37703 | B42: 178 | C42: 7 | D42: 0 | E42: 9 | F42: 185 | G42: 436 | H42: 18 | I42: 0 | J42: 10 | K42: 221 | L42: 31 | M42: 316 | N42: 106 | O42: 609
A43: 37711 | B43: 180 | C43: 9 | D43: 0 | E43: 9 | F43: 193 | G43: 438 | H43: 20 | I43: 0 | J43: 10 | K43: 238 | L43: 35 | M43: 318 | N43: 106 | O43: 614
A44: 37717 | B44: 186 | C44: 8 | D44: 0 | E44: 0 | F44: 175 | G44: 445 | H44: 19 | I44: 0 | J44: 0 | K44: 220 | L44: 35 | M44: 333 | N44: 106 | O44: 615
A45: 37726 | B45: 187 | C45: 8 | D45: 0 | E45: 0 | F45: 184 | G45: 450 | H45: 20 | I45: 0 | J45: 0 | K45: 245 | L45: 37 | M45: 333 | N45: 112 | O45: 622
A46: 37738 | B46: 228 | C46: 7 | D46: 0 | E46: 0 | F46: 141 | G46: 497 | H46: 19 | I46: 0 | J46: 0 | K46: 180 | L46: 31 | M46: 388 | N46: 119 | O46: 628
A47: 37745 | B47: 238 | C47: 8 | D47: 0 | E47: 0 | F47: 113 | G47: 515 | H47: 20 | I47: 0 | J47: 0 | K47: 148 | L47: 33 | M47: 415 | N47: 120 | O47: 632
A48: 37752 | B48: 216 | C48: 6 | D48: 0 | E48: 0 | F48: 112 | G48: 486 | H48: 8 | I48: 0 | J48: 0 | K48: 147 | L48: 49 | M48: 412 | N48: 108 | O48: 635
A49: 37766 | B49: 229 | C49: 7 | D49: 0 | E49: 0 | F49: 142 | G49: 509 | H49: 17 | I49: 0 | J49: 0 | K49: 199 | L49: 63 | M49: 354 | N49: 100 | O49: 652
A50: 37774 | B50: 225 | C50: 6 | D50: 0 | E50: 0 | F50: 140 | G50: 508 | H50: 16 | I50: 0 | J50: 0 | K50: 196 | L50: 66 | M50: 309 | N50: 96 | O50: 655
A51: 37782 | B51: 231 | C51: 7 | D51: 0 | E51: 0 | F51: 128 | G51: 517 | H51: 17 | I51: 0 | J51: 0 | K51: 184 | L51: 42 | M51: 338 | N51: 100 | O51: 661
A52: 37788 | B52: 242 | C52: 6 | D52: 0 | E52: 0 | F52: 153 | G52: 529 | H52: 18 | I52: 0 | J52: 0 | K52: 216 | L52: 39 | M52: 345 | N52: 104 | O52: 663
A53: 37794 | B53: 242 | C53: 6 | D53: 0 | E53: 0 | F53: 135 | G53: 529 | H53: 18 | I53: 0 | J53: 0 | K53: 197 | L53: 44 | M53: 338 | N53: 100 | O53: 666
A54: 37806 | B54: 261 | C54: 7 | D54: 0 | E54: 0 | F54: 130 | G54: 553 | H54: 18 | I54: 0 | J54: 0 | K54: 190 | L54: 22 | M54: 363 | N54: 103 | O54: 668
A55: 37820 | B55: 286 | C55: 18 | D55: 0 | E55: 0 | F55: 78 | G55: 583 | H55: 29 | I55: 0 | J55: 0 | K55: 125 | L55: 16 | M55: 365 | N55: 107 | O55: 673
A56: 37829 | B56: 300 | C56: 10 | D56: 0 | E56: 0 | F56: 73 | G56: 604 | H56: 21 | I56: 0 | J56: 0 | K56: 116 | L56: 13 | M56: 339 | N56: 114 | O56: 680
A57: 37846 | B57: 331 | C57: 6 | D57: 0 | E57: 0 | F57: 68 | G57: 646 | H57: 9 | I57: 0 | J57: 0 | K57: 101 | L57: 8 | M57: 364 | N57: 113 | O57: 693
A58: 37850 | B58: 332 | C58: 7 | D58: 0 | E58: 0 | F58: 67 | G58: 652 | H58: 9 | I58: 0 | J58: 0 | K58: 102 | L58: 9 | M58: 366 | N58: 114 | O58: 695