B1: Open DEFECTs that noone works with[1] | C1: Open DEFECTs that are started | D1: Resolved DEFECTS in 0.10[2] | E1: Resolved DEFECTS in 0.12 | F1: Resolved DEFECTS in 0.14 | G1: Resolved DEFECTS in 0.15.1 | H1: Resolved DEFECTS in 0.15.2 | I1: Resolved DEFECTS in 0.15.3 | J1: Open issues that noone works with[3] | K1: Open issues that are started | L1: Resolved in 0.10 | M1: Resolved in 0.12 | N1: Resolved in 0.14 | O1: Resolved in 0.15.1 | P1: Resolved in 0.15.2 | Q1: Resolved in 0.15.3 | R1: Rejected issues[4] | S1: Verified issues | T1: Open issues for Other[5] | U1: Members | V1: Critics Fired when RE ArgoUML | W1: CPU-time when importing everything
A2: 37332 | B2: 250 | C2: 7 | D2: 148 | F2: 0 | J2: 363 | K2: 12 | L2: 161 | N2: 0 | R2: 128 | S2: 14 | T2: 103
A3: 37339 | B3: 236 | C3: 10 | D3: 137 | F3: 0 | J3: 348 | K3: 15 | L3: 147 | N3: 0 | R3: 140 | S3: 23 | T3: 100
A4: 37346 | B4: 232 | C4: 11 | D4: 137 | F4: 0 | J4: =348-1 -> 347 | K4: 16 | L4: 147 | N4: 0 | R4: 144 | S4: 23 | T4: 98
A5: 37353 | B5: 231 | C5: 8 | D5: 154 | F5: 0 | J5: 348 | K5: 14 | L5: 166 | N5: 0 | R5: 144 | S5: 25 | T5: 101
A6: 37360 | B6: 232 | C6: 9 | D6: 144 | F6: 0 | J6: 350 | K6: 16 | L6: 156 | N6: 0 | R6: 146 | S6: 27 | T6: 102
A7: 37367 | B7: 229 | C7: 8 | D7: 145 | F7: 0 | J7: 353 | K7: 15 | L7: 157 | N7: 0 | R7: 147 | S7: 27 | T7: 105
A8: 37374 | B8: 231 | C8: 8 | D8: 145 | F8: 0 | J8: 354 | K8: 14 | L8: 157 | N8: 0 | R8: 150 | S8: 27 | T8: 105
A9: 37381 | B9: 236 | C9: 8 | D9: 150 | F9: 0 | J9: 364 | K9: 13 | L9: 163 | N9: 0 | R9: 151 | S9: 27 | T9: 110
A10: 37388 | B10: 218 | C10: 8 | D10: 142 | F10: 0 | J10: 366 | K10: 13 | L10: 155 | N10: 0 | R10: 115 | S10: 77 | T10: 108
A11: 37395 | B11: 221 | C11: 8 | D11: 142 | F11: 0 | J11: 370 | K11: 14 | L11: 155 | N11: 0 | R11: 115 | S11: 77 | T11: 110
A12: 37402 | B12: =223-1 -> 222 | C12: 8 | D12: 142 | F12: 0 | J12: =375-3 -> 372 | K12: 14 | L12: 155 | N12: 0 | R12: 116 | S12: 77 | T12: 110
A13: 37409 | B13: 227 | C13: 9 | D13: 142 | F13: 0 | J13: 379 | K13: 15 | L13: 155 | N13: 0 | R13: 116 | S13: 77 | T13: 110
A14: 37416 | B14: 229 | C14: 9 | D14: 10 | F14: 0 | J14: 379 | K14: 14 | L14: 23 | N14: 0 | R14: 118 | S14: 128 | T14: 109
A15: 37423 | B15: 225 | C15: 8 | D15: 10 | F15: 0 | J15: 382 | K15: 14 | L15: 23 | N15: 0 | R15: 119 | S15: 128 | T15: 112
A16: 37430 | B16: =AVERAGE(B15,B17) -> 232 | C16: =AVERAGE(C15,C17) -> 8 | D16: 10 | F16: 0 | J16: =AVERAGE(J15,J17) -> 389.5 | K16: =AVERAGE(K15,K17) -> 14.5 | L16: 23 | N16: 0 | R16: =AVERAGE(R15,R17) -> 120 | S16: =AVERAGE(S15,S17) -> 128 | T16: =AVERAGE(T15,T17) -> 113.5 | X16: Estimated
A17: 37437 | B17: =245-6 -> 239 | C17: 8 | D17: 10 | F17: 0 | J17: =403-6 -> 397 | K17: 15 | L17: 23 | N17: 0 | R17: 121 | S17: 128 | T17: 115
A18: 37444 | B18: =240-2 -> 238 | C18: 7 | D18: 12 | F18: 0 | J18: =401-3 -> 398 | K18: 15 | L18: 25 | N18: 0 | R18: 125 | S18: 131 | T18: 115 | V18: 3428
A19: 37451 | B19: 228 | C19: 8 | D19: 12 | F19: 0 | J19: 389 | K19: 17 | L19: 25 | N19: 0 | R19: 124 | S19: 130 | T19: 108 | V19: 3469
A20: 37458 | B20: =AVERAGE(B19,B21) -> 205.5 | C20: =AVERAGE(C19,C21) -> 7.5 | D20: 12 | F20: 0 | J20: =AVERAGE(J19,J21) -> 369 | K20: =AVERAGE(K19,K21) -> 17 | L20: 25 | N20: 0 | R20: =AVERAGE(R19,R21) -> 131 | S20: =AVERAGE(S19,S21) -> 130.5 | T20: =AVERAGE(T19,T21) -> 104.5 | V20: =AVERAGE(V19,V21) -> 3513 | X20: Estimated
A21: 37465 | B21: =174+1+1+2+2-1-10+1+13 -> 183 | C21: =9-2 -> 7 | D21: 12 | F21: 0 | J21: =341+1+2+2-1-10+1+13 -> 349 | K21: =19-2 -> 17 | L21: 25 | N21: 0 | R21: =139-1 -> 138 | S21: =132-1 -> 131 | T21: 101 | V21: 3557
A22: 37474 | B22: 169 | C22: 10 | D22: 11 | E22: 64 | F22: 0 | J22: 343 | K22: 19 | L22: 15 | M22: 67 | N22: 0 | R22: 142 | S22: 132 | T22: 107 | V22: 3557 | X22: Critics guessed
A23: 37479 | B23: =175-2+2 -> 175 | C23: 10 | D23: 11 | E23: 64 | F23: 0 | J23: =354-6+3 -> 351 | K23: 21 | L23: 15 | M23: 67 | N23: 0 | R23: 143 | S23: 130 | T23: 114 | V23: 2457
A24: 37486 | B24: 172 | C24: 10 | D24: 11 | E24: 66 | F24: 0 | J24: 351 | K24: 22 | L24: 15 | M24: 69 | N24: 0 | R24: 151 | S24: 130 | T24: 114 | V24: 2514
A25: 37493 | B25: 171 | C25: 8 | D25: 11 | E25: 84 | F25: 0 | J25: 350 | K25: 20 | L25: 15 | M25: 88 | N25: 0 | R25: 153 | S25: 130 | T25: 114 | V25: 2535
A26: 37500 | B26: 173 | C26: 9 | D26: 11 | E26: 84 | F26: 0 | J26: 357 | K26: 22 | L26: 15 | M26: 88 | N26: 0 | R26: 155 | S26: 131 | T26: 118 | V26: 2537
A27: 37507 | B27: 144 | C27: 5 | D27: 1 | E27: 57 | F27: 0 | J27: 340 | K27: 18 | L27: 4 | M27: 61 | N27: 0 | R27: 115 | S27: 213 | T27: 113 | V27: 2469
A28: 37514 | B28: 139 | C28: 5 | D28: 0 | E28: 6 | F28: 0 | J28: 334 | K28: 18 | L28: 3 | M28: 7 | N28: 0 | R28: 36 | S28: 351 | T28: 111 | V28: 2580 | X28: Problem to determine
A29: 37528 | B29: 159 | C29: 28 | D29: 0 | E29: 9 | F29: 0 | J29: 373 | K29: 46 | L29: 1 | M29: 11 | N29: 0 | R29: 12 | S29: 352 | T29: 108 | V29: 2602
A30: 37535 | B30: 164 | C30: 41 | D30: 0 | E30: 21 | F30: 0 | J30: 380 | K30: 61 | L30: 0 | M30: 22 | N30: 0 | R30: 9 | S30: 382 | T30: 111 | V30: 2594
A31: 37549 | B31: 194 | C31: 7 | D31: 0 | E31: 10 | F31: 0 | J31: 416 | K31: 26 | L31: 0 | M31: 11 | N31: 0 | R31: 14 | S31: 408 | T31: 109 | V31: 2743
A32: 37570 | B32: 196 | C32: 6 | D32: 0 | E32: 10 | F32: 0 | J32: 418 | K32: 22 | L32: 0 | M32: 11 | N32: 0 | R32: 13 | S32: 424 | T32: 104 | V32: 2342 | W32: 0.33194444444444443
A33: 37577 | B33: 208 | C33: 2 | D33: 0 | E33: 10 | F33: 0 | J33: 439 | K33: 10 | L33: 0 | M33: 11 | N33: 0 | R33: 13 | S33: 374 | T33: 105 | V33: 2344 | W33: 2.7777777777777776E-2 | X33: 0.13.1
A34: 37585 | B34: 197 | C34: 2 | D34: 0 | E34: 10 | F34: 0 | J34: 430 | K34: 12 | L34: 0 | M34: 11 | N34: 0 | R34: 19 | S34: 374 | T34: 106 | V34: 2349 | W34: 2.2916666666666669E-2
A35: 37592 | B35: 178 | C35: 3 | D35: 0 | E35: 10 | F35: 59 | J35: 410 | K35: 13 | L35: 0 | M35: 11 | N35: 68 | R35: 25 | S35: 378 | T35: 110
A36: 37598 | B36: 167 | C36: 2 | D36: 0 | E36: 10 | F36: 59 | J36: 402 | K36: 12 | L36: 0 | M36: 11 | N36: 68 | R36: 22 | S36: 385 | T36: 110 | V36: 2364 | W36: 1.5972222222222224E-2
A37: 37626 | B37: 158 | C37: 11 | D37: 0 | E37: 10 | F37: 59 | J37: 399 | K37: 23 | L37: 0 | M37: 11 | N37: 68 | R37: 20 | S37: 392 | T37: 106
A38: 37641 | B38: 163 | C38: 10 | D38: 0 | E38: 10 | F38: 59 | J38: 406 | K38: 22 | L38: 0 | M38: 11 | N38: 68 | R38: 15 | S38: 401 | T38: 108
A39: 37661 | B39: 166 | C39: 9 | D39: 0 | E39: 10 | F39: 11 | J39: 413 | K39: 19 | L39: 0 | M39: 11 | N39: 16 | R39: 12 | S39: 305 | T39: 104
A40: 37685 | B40: 183 | C40: 7 | D40: 0 | E40: 9 | F40: 169 | J40: 441 | K40: 17 | L40: 0 | M40: 10 | N40: 202 | R40: 25 | S40: 305 | T40: 107
A41: 37696 | B41: 184 | C41: 7 | D41: 0 | E41: 9 | F41: 186 | J41: 444 | K41: 17 | L41: 0 | M41: 10 | N41: 222 | R41: 26 | S41: 316 | T41: 107 | V41: 2861 | W41: 6.1342592592592594E-3
A42: 37703 | B42: 178 | C42: 7 | D42: 0 | E42: 9 | F42: 185 | J42: 436 | K42: 18 | L42: 0 | M42: 10 | N42: 221 | R42: 31 | S42: 316 | T42: 106 | U42: 609
A43: 37711 | B43: 180 | C43: 9 | D43: 0 | E43: 9 | F43: 193 | J43: 438 | K43: 20 | L43: 0 | M43: 10 | N43: 238 | R43: 35 | S43: 318 | T43: 106 | U43: 614
A44: 37717 | B44: 186 | C44: 8 | D44: 0 | E44: 0 | F44: 175 | J44: 445 | K44: 19 | L44: 0 | M44: 0 | N44: 220 | R44: 35 | S44: 333 | T44: 106 | U44: 615
A45: 37726 | B45: 187 | C45: 8 | D45: 0 | E45: 0 | F45: 184 | J45: 450 | K45: 20 | L45: 0 | M45: 0 | N45: 245 | R45: 37 | S45: 333 | T45: 112 | U45: 622
A46: 37738 | B46: 228 | C46: 7 | D46: 0 | E46: 0 | F46: 141 | J46: 497 | K46: 19 | L46: 0 | M46: 0 | N46: 180 | R46: 31 | S46: 388 | T46: 119 | U46: 628
A47: 37745 | B47: 238 | C47: 8 | D47: 0 | E47: 0 | F47: 113 | J47: 515 | K47: 20 | L47: 0 | M47: 0 | N47: 148 | R47: 33 | S47: 415 | T47: 120 | U47: 632
A48: 37752 | B48: 216 | C48: 6 | D48: 0 | E48: 0 | F48: 112 | J48: 486 | K48: 8 | L48: 0 | M48: 0 | N48: 147 | R48: 49 | S48: 412 | T48: 108 | U48: 635
A49: 37766 | B49: 229 | C49: 7 | D49: 0 | E49: 0 | F49: 142 | J49: 509 | K49: 17 | L49: 0 | M49: 0 | N49: 199 | R49: 63 | S49: 354 | T49: 100 | U49: 652
A50: 37774 | B50: 225 | C50: 6 | D50: 0 | E50: 0 | F50: 140 | J50: 508 | K50: 16 | L50: 0 | M50: 0 | N50: 196 | R50: 66 | S50: 309 | T50: 96 | U50: 655
A51: 37782 | B51: 231 | C51: 7 | D51: 0 | E51: 0 | F51: 128 | J51: 517 | K51: 17 | L51: 0 | M51: 0 | N51: 184 | R51: 42 | S51: 338 | T51: 100 | U51: 661
A52: 37788 | B52: 242 | C52: 6 | D52: 0 | E52: 0 | F52: 153 | J52: 529 | K52: 18 | L52: 0 | M52: 0 | N52: 216 | R52: 39 | S52: 345 | T52: 104 | U52: 663
A53: 37794 | B53: 242 | C53: 6 | D53: 0 | E53: 0 | F53: 135 | J53: 529 | K53: 18 | L53: 0 | M53: 0 | N53: 197 | R53: 44 | S53: 338 | T53: 100 | U53: 666
A54: 37806 | B54: 261 | C54: 7 | D54: 0 | E54: 0 | F54: 130 | J54: 553 | K54: 18 | L54: 0 | M54: 0 | N54: 190 | R54: 22 | S54: 363 | T54: 103 | U54: 668
A55: 37820 | B55: 286 | C55: 18 | D55: 0 | E55: 0 | F55: 78 | J55: 583 | K55: 29 | L55: 0 | M55: 0 | N55: 125 | R55: 16 | S55: 365 | T55: 107 | U55: 673
A56: 37829 | B56: 300 | C56: 10 | D56: 0 | E56: 0 | F56: 73 | J56: 604 | K56: 21 | L56: 0 | M56: 0 | N56: 116 | R56: 13 | S56: 339 | T56: 114 | U56: 680
A57: 37846 | B57: 331 | C57: 6 | D57: 0 | E57: 0 | F57: 68 | J57: 646 | K57: 9 | L57: 0 | M57: 0 | N57: 101 | R57: 8 | S57: 364 | T57: 113 | U57: 693
A58: 37850 | B58: 332 | C58: 7 | D58: 0 | E58: 0 | F58: 67 | J58: 652 | K58: 9 | L58: 0 | M58: 0 | N58: 102 | R58: 9 | S58: 366 | T58: 114 | U58: 695
A59: 37892 | B59: 383 | C59: 10 | D59: 0 | E59: 0 | F59: 64 | G59: 1 | J59: 701 | K59: 15 | L59: 0 | M59: 0 | N59: 100 | O59: 2 | R59: 26 | S59: 426 | T59: 107
A60: 37907 | B60: 395 | C60: 11 | D60: 0 | E60: 0 | F60: 64 | G60: 2 | J60: 709 | K60: 14 | L60: 0 | M60: 0 | N60: 100 | O60: 3 | R60: 34 | S60: 425 | T60: 106 | U60: =20*36+7 -> 727
A61: 37934 | B61: 403 | C61: 9 | D61: 0 | E61: 0 | F61: 64 | G61: 3 | J61: 711 | K61: 11 | L61: 0 | M61: 0 | N61: 88 | O61: 4 | R61: 44 | S61: 433 | T61: 109 | U61: =20*(38-1)+3 -> 743
A62: 37982 | B62: 394 | C62: 10 | D62: 0 | E62: 0 | F62: 63 | G62: 4 | H62: 78 | J62: 713 | K62: 13 | L62: 0 | M62: 0 | N62: 89 | O62: 5 | P62: 112 | R62: 47 | S62: 460 | T62: 89 | U62: =20*38+4 -> 764
A63: 37998 | B63: 401 | C63: 9 | D63: 0 | E63: 0 | F63: 65 | G63: 4 | H63: 79 | J63: 720 | K63: 12 | L63: 0 | M63: 0 | N63: 91 | O63: 5 | P63: 113 | R63: 46 | S63: 456 | T63: 91 | U63: =20*38+11 -> 771
A64: 38039 | B64: 435 | C64: 8 | D64: 0 | E64: 0 | F64: 29 | G64: 2 | H64: 26 | I64: 25 | J64: 766 | K64: 13 | L64: 0 | M64: 0 | N64: 50 | O64: 2 | P64: 39 | Q64: 32 | R64: 14 | S64: 340 | T64: 98 | U64: =20*40+2 -> 802