B1: Open DEFECTs that noone works with | C1: The list of Open DEFECTs that someone works with | D1: Resolved DEFECTS in 0.9.* | E1: Resolved DEFECTS in 0.11.1 | F1: Resolved DEFECTS in 0.11.2 | G1: Resolved DEFECTs in 0.11.3 | H1: Resolved DEFECTs in 0.11.4 | I1: Open issues that noone works with | J1: The list of Open issues that someone works with | K1: Resolved issues in 0.9.* | L1: Resolved issues in 0.11.1 | M1: Resolved issues in 0.11.2 | N1: Resolved issues in 0.11.3 | O1: Resolved issues in 0.11.4 | P1: Rejected issues | Q1: Verified issues | R1: The list of all Open issues for Other | S1: Critics Fired when RE ArgoUML | T1: CPU-time when importing everything
A2: 37332 | B2: 250 | C2: 7 | D2: 148 | I2: 363 | J2: 12 | K2: 161 | P2: 128 | Q2: 14 | R2: 103
A3: 37339 | B3: 236 | C3: 10 | D3: 137 | I3: 348 | J3: 15 | K3: 147 | P3: 140 | Q3: 23 | R3: 100
A4: 37346 | B4: 232 | C4: 11 | D4: 137 | I4: =348-1 -> 347 | J4: 16 | K4: 147 | P4: 144 | Q4: 23 | R4: 98
A5: 37353 | B5: 231 | C5: 8 | D5: 154 | I5: 348 | J5: 14 | K5: 166 | P5: 144 | Q5: 25 | R5: 101
A6: 37360 | B6: 232 | C6: 9 | D6: 144 | I6: 350 | J6: 16 | K6: 156 | P6: 146 | Q6: 27 | R6: 102
A7: 37367 | B7: 229 | C7: 8 | D7: 145 | I7: 353 | J7: 15 | K7: 157 | P7: 147 | Q7: 27 | R7: 105
A8: 37374 | B8: 231 | C8: 8 | D8: 145 | I8: 354 | J8: 14 | K8: 157 | P8: 150 | Q8: 27 | R8: 105
A9: 37381 | B9: 236 | C9: 8 | D9: 150 | I9: 364 | J9: 13 | K9: 163 | P9: 151 | Q9: 27 | R9: 110
A10: 37388 | B10: 218 | C10: 8 | D10: 142 | I10: 366 | J10: 13 | K10: 155 | P10: 115 | Q10: 77 | R10: 108
A11: 37395 | B11: 221 | C11: 8 | D11: 142 | I11: 370 | J11: 14 | K11: 155 | P11: 115 | Q11: 77 | R11: 110
A12: 37402 | B12: =223-1 -> 222 | C12: 8 | D12: 142 | I12: =375-3 -> 372 | J12: 14 | K12: 155 | P12: 116 | Q12: 77 | R12: 110
A13: 37409 | B13: 227 | C13: 9 | D13: 142 | I13: 379 | J13: 15 | K13: 155 | P13: 116 | Q13: 77 | R13: 110
A14: 37416 | B14: 229 | C14: 9 | D14: 10 | I14: 379 | J14: 14 | K14: 23 | P14: 118 | Q14: 128 | R14: 109
A15: 37423 | B15: 225 | C15: 8 | D15: 10 | I15: 382 | J15: 14 | K15: 23 | P15: 119 | Q15: 128 | R15: 112
A16: 37430 | B16: =AVERAGE(B15,B17) -> 232 | C16: =AVERAGE(C15,C17) -> 8 | D16: 10 | I16: =AVERAGE(I15,I17) -> 389.5 | J16: =AVERAGE(J15,J17) -> 14.5 | K16: 23 | P16: =AVERAGE(P15,P17) -> 120 | Q16: =AVERAGE(Q15,Q17) -> 128 | R16: =AVERAGE(R15,R17) -> 113.5 | U16: Estimated
A17: 37437 | B17: =245-6 -> 239 | C17: 8 | D17: 10 | I17: =403-6 -> 397 | J17: 15 | K17: 23 | P17: 121 | Q17: 128 | R17: 115
A18: 37444 | B18: =240-2 -> 238 | C18: 7 | D18: 12 | I18: =401-3 -> 398 | J18: 15 | K18: 25 | P18: 125 | Q18: 131 | R18: 115 | S18: 3428
A19: 37451 | B19: 228 | C19: 8 | D19: 12 | I19: 389 | J19: 17 | K19: 25 | P19: 124 | Q19: 130 | R19: 108 | S19: 3469
A20: 37458 | B20: =AVERAGE(B19,B21) -> 205.5 | C20: =AVERAGE(C19,C21) -> 7.5 | D20: 12 | I20: =AVERAGE(I19,I21) -> 369 | J20: =AVERAGE(J19,J21) -> 17 | K20: 25 | P20: =AVERAGE(P19,P21) -> 131 | Q20: =AVERAGE(Q19,Q21) -> 130.5 | R20: =AVERAGE(R19,R21) -> 104.5 | S20: =AVERAGE(S19,S21) -> 3513 | U20: Estimated
A21: 37465 | B21: =174+1+1+2+2-1-10+1+13 -> 183 | C21: =9-2 -> 7 | D21: 12 | I21: =341+1+2+2-1-10+1+13 -> 349 | J21: =19-2 -> 17 | K21: 25 | P21: =139-1 -> 138 | Q21: =132-1 -> 131 | R21: 101 | S21: 3557
A22: 37474 | B22: 169 | C22: 10 | D22: 11 | E22: 64 | I22: 343 | J22: 19 | K22: 15 | L22: 67 | P22: 142 | Q22: 132 | R22: 107 | S22: 3557 | U22: Critics guessed
A23: 37479 | B23: =175-2+2 -> 175 | C23: 10 | D23: 11 | E23: =66-2 -> 64 | I23: =354-6+3 -> 351 | J23: 21 | K23: 15 | L23: =69-2 -> 67 | P23: 143 | Q23: 130 | R23: 114 | S23: 2457
A24: 37486 | B24: 172 | C24: 10 | D24: 11 | E24: 66 | I24: 351 | J24: 22 | K24: 15 | L24: 69 | P24: 151 | Q24: 130 | R24: 114 | S24: 2514
A25: 37493 | B25: 171 | C25: 8 | D25: 11 | E25: 67 | F25: 17 | I25: 350 | J25: 20 | K25: 15 | L25: 70 | M25: 18 | P25: 153 | Q25: 130 | R25: 114 | S25: 2535
A26: 37500 | B26: 173 | C26: 9 | D26: 11 | E26: 67 | F26: 17 | I26: 357 | J26: 22 | K26: 15 | L26: 70 | M26: 18 | P26: 155 | Q26: 131 | R26: 118 | S26: 2537
A27: 37507 | B27: 144 | C27: 5 | D27: 1 | E27: 55 | F27: 2 | I27: 340 | J27: 18 | K27: 4 | L27: 58 | M27: 3 | P27: 115 | Q27: 213 | R27: 113 | S27: 2469
A28: 37514 | B28: 139 | C28: 5 | D28: 0 | E28: 5 | F28: 1 | I28: 334 | J28: 18 | K28: 3 | L28: 6 | M28: 1 | P28: 36 | Q28: 351 | R28: 111 | S28: 2580 | U28: Problem to determine
A29: 37528 | B29: 159 | C29: 28 | D29: 0 | E29: 2 | F29: 0 | G29: 7 | I29: 373 | J29: 46 | K29: 1 | L29: 3 | M29: 0 | N29: 8 | P29: 12 | Q29: 352 | R29: 108 | S29: 2602
A30: 37535 | B30: 164 | C30: 41 | D30: 0 | E30: 2 | F30: 0 | G30: 8 | H30: 11 | I30: 380 | J30: 61 | K30: 0 | L30: 2 | M30: 0 | N30: 9 | O30: 11 | P30: 9 | Q30: 382 | R30: 111 | S30: 2594
A31: 37549 | B31: 194 | C31: 7 | D31: 0 | E31: 1 | F31: 0 | G31: 6 | H31: 3 | I31: 416 | J31: 26 | K31: 0 | L31: 1 | M31: 0 | N31: 7 | O31: 3 | P31: 14 | Q31: 408 | R31: 109 | S31: 2743
A32: 37570 | B32: 196 | C32: 6 | D32: 0 | E32: 1 | F32: 0 | G32: 6 | H32: 3 | I32: 418 | J32: 22 | K32: 0 | L32: 1 | M32: 0 | N32: 7 | O32: 3 | P32: 13 | Q32: 424 | R32: 104 | S32: 2342 | T32: 0.33194444444444443
A33: 37577 | B33: 208 | C33: 2 | D33: 0 | E33: 1 | F33: 0 | G33: 6 | H33: 3 | I33: 439 | J33: 10 | K33: 0 | L33: 1 | M33: 0 | N33: 7 | O33: 3 | P33: 13 | Q33: 374 | R33: 105 | S33: 2344 | T33: 2.7777777777777776E-2 | U33: 0.13.1
A34: 37585 | B34: 197 | C34: 2 | D34: 0 | E34: 1 | F34: 0 | G34: 6 | H34: 3 | I34: 430 | J34: 12 | K34: 0 | L34: 1 | M34: 0 | N34: 7 | O34: 3 | P34: 19 | Q34: 374 | R34: 106 | S34: 2349 | T34: 2.2916666666666669E-2
A35: 37592 | B35: 176 | C35: 3 | D35: 0 | E35: 1 | F35: 0 | G35: 6 | H35: 3 | I35: 408 | J35: 13 | K35: 0 | L35: 1 | M35: 0 | N35: 7 | O35: 3 | P35: 25 | Q35: 378 | R35: 109